{
  "schema_version": 1,
  "generated_at": "2026-07-18T00:00:00.000Z",
  "generator": "scripts/generate-collation-preflight.mjs",
  "policy": "本包只提供AI预审候选；不填写、不替代、不推断真人审核字段。所有锚点须绑定影像页后才可晋级。",
  "editions": [
    {
      "edition_id": "jingui:sibu-yuqiao",
      "work_id": "jingui_yaolue",
      "ocr_layer": {
        "state": "transcription_only",
        "source_binding_required": true,
        "page_fields": [
          "source_sha256",
          "page",
          "folio",
          "text",
          "engine",
          "engine_version",
          "requires_human_review"
        ],
        "immutable_machine_output": true
      },
      "structure_layer": {
        "levels": [
          "chapter",
          "text_unit",
          "formula"
        ],
        "text_layers": [
          "base_text",
          "commentary",
          "editorial_note"
        ],
        "state": "blocked"
      },
      "blocking_reasons": [
        "当前文本没有逐条绑定扫描页码，不能视为影像核验本"
      ]
    },
    {
      "edition_id": "jingui:zhaokaimei-1599",
      "work_id": "jingui_yaolue",
      "ocr_layer": {
        "state": "blocked",
        "source_binding_required": true,
        "page_fields": [
          "source_sha256",
          "page",
          "folio",
          "text",
          "engine",
          "engine_version",
          "requires_human_review"
        ],
        "immutable_machine_output": true
      },
      "structure_layer": {
        "levels": [
          "chapter",
          "text_unit",
          "formula"
        ],
        "text_layers": [
          "base_text",
          "commentary",
          "editorial_note"
        ],
        "state": "blocked"
      },
      "blocking_reasons": [
        "合集须先确定《金匱》起止页；不得把《伤寒》与《金匱》混切"
      ]
    },
    {
      "edition_id": "jingui:wuqian-1395",
      "work_id": "jingui_yaolue",
      "ocr_layer": {
        "state": "blocked",
        "source_binding_required": true,
        "page_fields": [
          "source_sha256",
          "page",
          "folio",
          "text",
          "engine",
          "engine_version",
          "requires_human_review"
        ],
        "immutable_machine_output": true
      },
      "structure_layer": {
        "levels": [
          "chapter",
          "text_unit",
          "formula"
        ],
        "text_layers": [
          "base_text",
          "commentary",
          "editorial_note"
        ],
        "state": "blocked"
      },
      "blocking_reasons": [
        "须在导入前复核文件页许可、卷首卷尾及缺叶"
      ]
    },
    {
      "edition_id": "shanghan:zhaokaimei-1599",
      "work_id": "shanghan_lun",
      "ocr_layer": {
        "state": "transcription_only",
        "source_binding_required": true,
        "page_fields": [
          "source_sha256",
          "page",
          "folio",
          "text",
          "engine",
          "engine_version",
          "requires_human_review"
        ],
        "immutable_machine_output": true
      },
      "structure_layer": {
        "levels": [
          "chapter",
          "text_unit",
          "formula"
        ],
        "text_layers": [
          "base_text",
          "commentary",
          "editorial_note"
        ],
        "state": "blocked"
      },
      "blocking_reasons": [
        "须用影像替换当前笠翁堂文本中的空页码定位",
        "当前文本没有逐条绑定扫描页码，不能视为影像核验本"
      ]
    },
    {
      "edition_id": "shanghan:kangping",
      "work_id": "shanghan_lun",
      "ocr_layer": {
        "state": "transcription_only",
        "source_binding_required": true,
        "page_fields": [
          "source_sha256",
          "page",
          "folio",
          "text",
          "engine",
          "engine_version",
          "requires_human_review"
        ],
        "immutable_machine_output": true
      },
      "structure_layer": {
        "levels": [
          "chapter",
          "text_unit",
          "formula"
        ],
        "text_layers": [
          "base_text",
          "commentary",
          "editorial_note"
        ],
        "state": "blocked"
      },
      "blocking_reasons": [
        "1947年鉴定本；经文、注文与校者说明必须按字距和层级拆分",
        "当前文本没有逐条绑定扫描页码，不能视为影像核验本"
      ]
    },
    {
      "edition_id": "shanghan:guilin-baiyunge",
      "work_id": "shanghan_lun",
      "ocr_layer": {
        "state": "transcription_only",
        "source_binding_required": true,
        "page_fields": [
          "source_sha256",
          "page",
          "folio",
          "text",
          "engine",
          "engine_version",
          "requires_human_review"
        ],
        "immutable_machine_output": true
      },
      "structure_layer": {
        "levels": [
          "chapter",
          "text_unit",
          "formula"
        ],
        "text_layers": [
          "base_text",
          "commentary",
          "editorial_note"
        ],
        "state": "blocked"
      },
      "blocking_reasons": [
        "当前文本没有逐条绑定扫描页码，不能视为影像核验本"
      ]
    }
  ],
  "anchors": [
    {
      "anchor_id": "anchor:shanghan_lun:001",
      "work_id": "shanghan_lun",
      "edition_id": "shanghan_lun:song",
      "source_locator": "S0001",
      "text_excerpt": "夫《伤寒论》，盖祖述大圣人之意，诸家莫其伦拟。故晋皇甫谧序《甲乙针经》云：伊尹以元圣之才，撰用《神农本草》，以为汤液。汉张仲景论广汤液，为数十卷，用之多验。近世太医令王叔和，撰次仲景遗论甚精，皆可施用。是仲景本伊尹之法，伊尹本神农之经，得不谓祖述大圣人之意乎？",
      "candidate_kind": "chapter",
      "state": "blocked_missing_scan_locator",
      "blocking_reasons": [
        "来源记录尚未绑定扫描文件、页码与版面区域"
      ],
      "requires_human_review": true
    },
    {
      "anchor_id": "anchor:shanghan_lun:002",
      "work_id": "shanghan_lun",
      "edition_id": "shanghan_lun:song",
      "source_locator": "S0002",
      "text_excerpt": "张仲景《汉书》无传。见《名医录》云：南阳人，名机，仲景乃其字也。举孝廉，官至长沙太守，始受术于同郡张伯祖。时人言，识用精微过其师。所著论，其言精而奥，其法简而详，非浅闻寡见者所能及。自仲景于今八百余年，惟王叔和能学之，其间如葛洪、陶（弘）景、胡洽、徐之才、孙思邈辈，非不才也，但各自名家，而不能修明之。开宝中，节度使高继冲，曾编录进上。其文理舛错，未尝考正。历代虽藏之书府，亦阙于雠校，是使治病之流，举天下无或知者。国家诏儒臣校正医书，臣奇续被其选。以为百病之急，无急于伤寒。今先校定张仲景《伤寒论》十卷，总二十二篇，证外合三百九十七法，除重复，定有一百一十二方，今请颁行。",
      "candidate_kind": "chapter",
      "state": "blocked_missing_scan_locator",
      "blocking_reasons": [
        "来源记录尚未绑定扫描文件、页码与版面区域"
      ],
      "requires_human_review": true
    },
    {
      "anchor_id": "anchor:shanghan_lun:003",
      "work_id": "shanghan_lun",
      "edition_id": "shanghan_lun:song",
      "source_locator": "S0003",
      "text_excerpt": "太子右赞善大夫臣 高保衡 尚书屯田员外郎臣 孙 奇 尚书司封郎中秘阁校理臣 林 亿 等 谨上",
      "candidate_kind": "chapter",
      "state": "blocked_missing_scan_locator",
      "blocking_reasons": [
        "来源记录尚未绑定扫描文件、页码与版面区域"
      ],
      "requires_human_review": true
    },
    {
      "anchor_id": "anchor:shanghan_lun:004",
      "work_id": "shanghan_lun",
      "edition_id": "shanghan_lun:song",
      "source_locator": "S0004",
      "text_excerpt": "论曰：余每览越人入虢之诊，望齐侯之色，未尝不慨然叹其才秀也。怪当今居世之士，曾不留神医药，精究方术，上以疗君亲之疾，下以救贫贱之厄，中以保身长全，以养其生。但竞逐荣势，企踵权豪，孜孜汲汲，惟名利是务；崇饰其末，忽弃其本，华其外而悴其内。皮之不存，毛将安附焉？卒然遭邪风之气，婴非常之疾，患及祸至，而方震栗。降志屈节，钦望巫祝，告穷归天，束手受败。赍百年之寿命，持至贵之重器，委付凡医，恣其所措。咄嗟呜呼！厥身已毙，神明消灭，变为异物，幽潜重泉，徒为啼泣。痛夫！举世昏迷，莫能觉悟，不惜其命，若是轻生，彼何荣势之云哉？而进不能爱人知人，退不能爱身知已，遇灾值祸，身居厄地；蒙蒙昧昧，蠢若游魂。哀乎！趋世",
      "candidate_kind": "chapter",
      "state": "blocked_missing_scan_locator",
      "blocking_reasons": [
        "来源记录尚未绑定扫描文件、页码与版面区域"
      ],
      "requires_human_review": true
    },
    {
      "anchor_id": "anchor:shanghan_lun:005",
      "work_id": "shanghan_lun",
      "edition_id": "shanghan_lun:song",
      "source_locator": "S0005",
      "text_excerpt": "余宗族素多，向余二百。建安纪年以来，犹未十稔，其死亡者，三分有二，伤寒十居其七。感往昔之沦丧，伤横夭之莫救，乃勤求古训，博采众方，撰用《素问》、《九卷》、《八十一难》、《阴阳大论》、《胎胪药录》，并平脉辨证，为《伤寒杂病论》合十六卷，虽未能尽愈诸病，庶可以见病知源，若能寻余所集，思过半矣。",
      "candidate_kind": "chapter",
      "state": "blocked_missing_scan_locator",
      "blocking_reasons": [
        "来源记录尚未绑定扫描文件、页码与版面区域"
      ],
      "requires_human_review": true
    },
    {
      "anchor_id": "anchor:shanghan_lun:006",
      "work_id": "shanghan_lun",
      "edition_id": "shanghan_lun:song",
      "source_locator": "S0006",
      "text_excerpt": "夫天布五行，以运万类；人禀五常，以有五脏。经络府俞，阴阳会通；玄冥幽微，变化难极。自非才高识妙，岂能探其理致哉！上古有神农、黄帝、歧伯、伯高、雷公、少俞、少师、仲文，中世有长桑、扁鹊，汉有公乘阳庆及仓公。下此以往，未之闻也。",
      "candidate_kind": "chapter",
      "state": "blocked_missing_scan_locator",
      "blocking_reasons": [
        "来源记录尚未绑定扫描文件、页码与版面区域"
      ],
      "requires_human_review": true
    },
    {
      "anchor_id": "anchor:shanghan_lun:007",
      "work_id": "shanghan_lun",
      "edition_id": "shanghan_lun:song",
      "source_locator": "S0007",
      "text_excerpt": "观今之医，不念思求经旨，以演其所知；各承家技，终始顺旧。省疾问病，务在口给；相对斯须，便处汤药。按寸不及尺，握手不及足；人迎、趺阳，三部不参；动数发息，不满五十。短期未知决诊，九候曾无仿佛。明堂阙庭，尽不见察，所谓窥管而已。夫能视死别生，实为难矣！",
      "candidate_kind": "chapter",
      "state": "blocked_missing_scan_locator",
      "blocking_reasons": [
        "来源记录尚未绑定扫描文件、页码与版面区域"
      ],
      "requires_human_review": true
    },
    {
      "anchor_id": "anchor:shanghan_lun:008",
      "work_id": "shanghan_lun",
      "edition_id": "shanghan_lun:song",
      "source_locator": "S0008",
      "text_excerpt": "孔子云：生而知之者上，学则亚之。多闻博识，知之次也。余素尚方术，请事斯语。",
      "candidate_kind": "chapter",
      "state": "blocked_missing_scan_locator",
      "blocking_reasons": [
        "来源记录尚未绑定扫描文件、页码与版面区域"
      ],
      "requires_human_review": true
    },
    {
      "anchor_id": "anchor:shanghan_lun:009",
      "work_id": "shanghan_lun",
      "edition_id": "shanghan_lun:song",
      "source_locator": "S0009",
      "text_excerpt": "问曰：脉有阴阳者，何谓也？答曰：凡脉大、浮、数、动、滑，此名阳也；脉沈、濇、弱、弦、微，此名阴也，凡阴病见阳脉者生，阳病见阴脉者死。",
      "candidate_kind": "text_unit",
      "state": "blocked_missing_scan_locator",
      "blocking_reasons": [
        "来源记录尚未绑定扫描文件、页码与版面区域"
      ],
      "requires_human_review": true
    },
    {
      "anchor_id": "anchor:shanghan_lun:010",
      "work_id": "shanghan_lun",
      "edition_id": "shanghan_lun:song",
      "source_locator": "S0010",
      "text_excerpt": "问曰：脉有阳结阴结者，何以别之？答曰：其脉浮而数，能食，不大便者，此为实，名曰阳结也，期十七日当剧。其脉沈而迟，不能食，身体重，大便反鞕，名曰阴结也，期十四日当剧。",
      "candidate_kind": "text_unit",
      "state": "blocked_missing_scan_locator",
      "blocking_reasons": [